{
  "schema_version": 1,
  "phase": "I",
  "policy_id": "sanitized-ai-compatibility-view",
  "projection_mode": "generated_allowlist_projection",
  "ai_connection_enabled": false,
  "raw_observation_export_enabled": false,
  "read_only": true,
  "metadata_only": true,
  "non_authoritative": true,
  "non_executable": true,
  "allowed_operations": [
    "summarize",
    "explain_relationships",
    "answer_metadata_questions",
    "suggest_reviews"
  ],
  "forbidden_operations": [
    "modify_records",
    "execute_actions",
    "change_authority",
    "approve_recovery",
    "delete",
    "restore",
    "move_files"
  ],
  "allowed_categories": [
    "resource_types",
    "project_concepts",
    "application_concepts",
    "classifications",
    "relationships",
    "confidence",
    "evidence_summaries",
    "recommendations"
  ],
  "forbidden_fields": [
    "absolute_path",
    "path",
    "home_directory",
    "username",
    "filename",
    "file_name",
    "content",
    "document_text",
    "student_data",
    "student_name",
    "credentials",
    "token",
    "api_key",
    "password",
    "secret",
    "environment_variables",
    "raw_observation",
    "raw_observations",
    "private_document",
    "private_documents",
    "filesystem_handle",
    "local_locator",
    "actor_private_id",
    "extracted_text",
    "ocr_text",
    "embedding"
  ],
  "blocked_sensitivities": ["student_private", "restricted", "unknown"],
  "identity_fields": ["entity_id", "label", "type", "authority", "confidence", "review_state"],
  "explanation_fields": ["source_systems", "evidence", "confidence", "review_state", "uncertainty", "action_authority"],
  "required_gates": ["policy_validation", "classification", "sanitization", "projection_validation"],
  "action_capabilities": []
}
